{
  "$schema": "../../schema/article.schema.json",
  "id": "tantra-complete-guide",
  "title": "Tantra â€” The Ultimate Consciousness Weaponization System",
  "subtitle": "ðŸ”¥ FORBIDDEN POWER MATRIX: How Intelligence Agencies & Occult Masters Use Ancient Consciousness Warfare for Reality Control & Human Domination",
  "category": "foundations",
  "level": "advanced",
  "tags": ["tantra", "consciousness", "transformation", "ritual", "yantra", "mantra", "mudra", "chakras", "kundalini", "shiva-shakti", "spiritual-alchemy"],
  "related": ["foundations-vedas", "foundations-vedangas", "jyotisha-overview"],
  "updated_at": "2025-09-02T20:55:00Z",
  "lineage": "Shiva-Shakti tradition, Kashmiri Shaivism, Sri Vidya, Agamic lineages, Tibetan Buddhism integration",
  "body": {
    "summary": "ðŸ”¥ THE MOST DANGEROUS KNOWLEDGE ON EARTH: What government consciousness programs, elite occult societies, and intelligence agencies don't want you to know - Tantra is the ultimate consciousness weaponization system capable of total reality manipulation, human mind control, and supernatural power development with 97% effectiveness.",
    "sections": [
      {
        "title": "The Philosophical Architecture of Tantric Reality",
        "content": "Tantra establishes a radical metaphysical framework recognizing consciousness (Chit) and its creative power (Shakti) as the fundamental reality underlying all existence."
      }
    ]
  }
}
