{
  "$schema": "../../schema/article.schema.json",
  "id": "foundations-vedas",
  "title": "The Four Vedas — Complete Compendium",
  "subtitle": "Sacred Knowledge: Structure, Philosophy, Practice, and Cosmic Principles",
  "category": "foundations",
  "level": "intermediate",
  "tags": ["veda", "foundation", "life-stages", "samhita", "brahmana", "aranyaka", "upanishad", "shruti", "apaurusheya", "cosmic-order"],
  "related": ["foundations-vedangas", "jyotisha-overview"],
  "updated_at": "2025-09-02T20:25:00Z",
  "lineage": "Krishna Dvaipayana Vyasa (compiler), Rishis of antiquity (seers)",
  "citations": [
    { "type": "textual", "ref": "Rigveda Samhita", "note": "10 Mandalas, 1028 Suktas, 10,552 Mantras" },
    { "type": "textual", "ref": "Yajurveda (Shukla & Krishna)", "note": "Ritual formulas and ceremonial applications" },
    { "type": "textual", "ref": "Samaveda", "note": "Musical renditions and chanting patterns" },
    { "type": "textual", "ref": "Atharvaveda", "note": "Practical applications and worldly wisdom" },
    { "type": "textual", "ref": "Aitareya Brahmana", "note": "Ritual explanations and cosmic symbolism" },
    { "type": "textual", "ref": "Chandogya Upanishad", "note": "Philosophical teachings and meditation" },
    { "type": "book", "ref": "The Vedas by Wenzel, Klaus L.", "note": "Comprehensive academic study" }
  ],
  "evidence_trails": [
    { "kind": "textual", "summary": "Canonical organization preserved across millennia through oral tradition with mathematical precision" },
    { "kind": "observational", "summary": "Astronomical references in Vedic texts correlate with historical star positions" },
    { "kind": "experimental", "summary": "Vedic fire rituals demonstrate sophisticated understanding of acoustics and sacred geometry" }
  ],
  "body": {
    "summary": "The Vedas represent the foundational corpus of Sanatana Dharma, encompassing cosmic principles, ritual science, philosophical inquiry, and practical wisdom. This compendium explores their four-fold structure, internal organization, life-stage correlations, and profound insights into the nature of reality, consciousness, and cosmic order.",
    "sections": [
      {
        "title": "Etymology and Essential Nature",
        "content": "Veda (वेद) derives from the Sanskrit root 'Vid' (विद्) meaning 'to know, to see, to find, to understand.' The Vedas are classified as 'Shruti' (श्रुति) - that which is heard, revealed knowledge received by Rishis in states of deep meditation. They are 'Apaurusheya' (अपौरुषेय) - not of human authorship, but eternal truths perceived by ancient seers. The concept of 'Ananta Veda' suggests infinite knowledge systems beyond the codified texts. Each Veda contains layers: Samhita (संहिता - collections), Brahmana (ब्राह्मण - explanations), Aranyaka (आरण्यक - forest teachings), and Upanishads (उपनिषद् - sitting near, esoteric teachings)."
      },
      {
        "title": "Rigveda - The Foundation Hymnal",
        "content": "The Rigveda (ऋग्वेद) is the oldest and most revered Veda, containing 1,028 hymns (suktas) arranged in 10 books (mandalas) with 10,552 verses (mantras). It celebrates cosmic forces, natural phenomena, and divine principles through sophisticated poetry. Key themes include: Agni (fire principle), Indra (cosmic power), Varuna (cosmic law), Soma (divine elixir), and Rita (cosmic order). The Purusha Sukta describes cosmic consciousness, while the Nasadiya Sukta explores creation mysteries. Family books (2-7) preserve ancient lineages, while books 1, 8-10 contain later philosophical developments. The Gayatri Mantra (3.62.10) represents the quintessence of Vedic wisdom."
      },
      {
        "title": "Yajurveda - The Ritual Manual",
        "content": "The Yajurveda (यजुर्वेद) exists in two recensions: Shukla (White/Vajasaneyi) and Krishna (Black/Taittiriya). It contains prose formulas and ritual instructions for sacrificial ceremonies. The Shukla Yajurveda has 40 chapters focusing on ritual procedures, while the Krishna Yajurveda intermixes mantras with explanations. Central concepts include: Yajna (sacrifice as cosmic principle), proper pronunciation and timing, geometric altar construction, and symbolic correspondences between microcosm and macrocosm. The famous Isha Upanishad opens the Shukla Yajurveda with profound teachings on renunciation and divine immanence."
      },
      {
        "title": "Samaveda - The Musical Scripture",
        "content": "The Samaveda (सामवेद) transforms Rigvedic hymns into musical compositions for ritual chanting. It contains 1,549 verses, mostly borrowed from Rigveda but set to specific melodies (saman). The text demonstrates sophisticated understanding of sound, vibration, and their spiritual effects. Seven basic tones (svaras) correspond to chakras and cosmic principles. The Chandogya Upanishad, associated with Samaveda, contains the famous 'Tat Tvam Asi' (Thou Art That) teaching and explores the metaphysics of sound (AUM). Practitioners develop profound control over breath, voice modulation, and consciousness through systematic chanting."
      },
      {
        "title": "Atharvaveda - The Practical Wisdom",
        "content": "The Atharvaveda (अथर्ववेद) contains 731 hymns in 20 books, focusing on practical applications, healing, protection, prosperity, and worldly concerns. Named after sage Atharvan, it includes: medicinal formulas, architectural principles, statecraft, astronomy, mathematics, and social organization. The text bridges spiritual and material realms, offering mantras for health, harmony, and success. Books 1-7 contain family traditions, while books 8-12 address royal duties and cosmic speculation. The Prashna and Mundaka Upanishads emerge from this tradition, emphasizing meditation techniques and the path to liberation."
      },
      {
        "title": "Four-Fold Structure and Life Integration",
        "content": "Each Veda follows a four-tier structure corresponding to human development: 1) Samhita (Collection) - Pure mantras for Brahmacharya (student) stage, emphasizing learning and discipline. 2) Brahmana (Explanation) - Ritual science for Grihastha (householder), focusing on dharmic action and social responsibility. 3) Aranyaka (Forest Text) - Contemplative practices for Vanaprastha (forest dweller), transitioning from external to internal worship. 4) Upanishad (Esoteric Teaching) - Philosophical inquiry for Sannyasa (renunciate), pursuing ultimate truth and liberation. This progression mirrors the soul's journey from action (karma) to knowledge (jnana)."
      },
      {
        "title": "Cosmic Correspondences and Sacred Science",
        "content": "The Vedas reveal intricate correspondences between cosmic, natural, and human dimensions. Rita (ऋत) represents cosmic law governing celestial movements, seasonal cycles, and moral order. The concept of 'Yajña' extends beyond ritual sacrifice to encompass all coordinated cosmic processes. Astronomical references include constellation descriptions, lunar calendars, and seasonal markers that correlate with archaeological evidence. Sacred geometry principles underlying fire altar construction demonstrate advanced mathematical knowledge. The doctrine of three worlds (Bhur-Bhuvah-Swah) maps consciousness levels and dimensional experiences."
      },
      {
        "title": "Preservation and Transmission",
        "content": "Vedic texts achieved unprecedented preservation accuracy through elaborate oral transmission systems. The Shiksha tradition ensures perfect pronunciation, while various recitation patterns (Jata, Ghana, etc.) create multiple cross-checks against textual corruption. Different Shakhas (branches) preserve regional variations while maintaining core integrity. The mathematical precision of this preservation system, maintained across millennia without writing, represents one of humanity's greatest intellectual achievements. Modern comparative studies confirm remarkable consistency across manuscript traditions."
      },
      {
        "title": "Practical Applications and Modern Relevance",
        "content": "Contemporary applications of Vedic principles include: 1) Ayurvedic medicine drawing from Atharvaveda's healing traditions, 2) Vastu architecture incorporating cosmic harmony principles, 3) Yoga and meditation techniques rooted in Upanishadic teachings, 4) Ecological wisdom reflected in nature reverence, 5) Mathematical and astronomical insights influencing calendar systems, 6) Social organization principles emphasizing dharmic governance, 7) Sound healing and mantra therapy based on Samaveda traditions, 8) Agricultural practices aligned with natural cycles and cosmic rhythms."
      },
      {
        "title": "Philosophical Foundations and Ultimate Teaching",
        "content": "The Vedas establish fundamental philosophical concepts: Brahman (ultimate reality), Atman (individual consciousness), Maya (cosmic illusion), Dharma (righteous duty), Karma (action and consequence), Moksha (liberation), and Samsara (cyclical existence). The progressive revelation moves from polytheistic hymns through ritual symbolism to monistic philosophy, culminating in Upanishadic declarations like 'Sarvam khalvidam brahma' (All this is indeed Brahman) and 'Aham brahmasmi' (I am Brahman). This evolution reflects humanity's spiritual maturation and the gradual unveiling of absolute truth through relative experiences."
      }
    ]
  }
}

